<?xml version="1.0" encoding="UTF-8"?>
<!DOCTYPE config SYSTEM "config.dtd">
<config>
	<section name="db">
		<param name="url" value="jdbc:mysql://localhost:3306/nemovelo" />
		<param name="user" value="root" />
		<param name="password" value="" />
	</section>
	<section name="log">
		<param name="unique" value="true" />
	</section>
	<section name="gui">
		<param name="cloned" value="false" />
	</section>
</config>
